review,aspects,scores,sentiment,sentiment_score
Trip Verified    fly British Airways weekly not because  want  but because they own the route theres  other option therefore they frankly dont have  care about the customer The flights are always delayed and its always someone elses fault   weather delays ,"['flight delays', 'staff attitude', 'customer service']","[0.9898610711097717, 0.9106320738792419, 0.7548799514770508]",negative,0.8266869783401489
Not Verified   Everything was  until our connecting flight  London just before take off  were  the runway the pilot came   announce  engine problem After engineers tried  fix  while  waited  the plane for over  hour  were finally told that  would have   ev,"['flight delays', 'customer service', 'staff attitude']","[0.9778859615325928, 0.631066620349884, 0.47435301542282104]",negative,0.5465201139450073
Not Verified    initial flight was cancelled  hours prior the flight Then  was automatically rescheduled for next day Next day the flight was delayed leaving Hamburg and missed  connecting flight  Las Vegas  and several other passengers spent the night  Lo,"['flight delays', 'booking problems', 'customer service']","[0.9909248948097229, 0.9896066784858704, 0.899494469165802]",negative,0.6764123439788818
Not Verified    will never fly British Airways again Our flight  July   from LHR  LAX was cancelled  hours before departure without any explanation Since  weeks  are now waiting for the refund and  does not pay  the cost caused  the cancellation Very disap,"['booking problems', 'staff attitude', 'flight delays']","[0.9906629920005798, 0.9832970499992371, 0.9415980577468872]",negative,0.9090963006019592
Trip Verified  Check  and security clearance very quick  LHR   wife and  used the Galleries North lounge and    was easy  get  seat Good buffet breakfast options Flight boarded  time and flight departed  time  was seated    the Club Europe seats  the  seem,"['customer service', 'lounge experience', 'seat comfort']","[0.9724522829055786, 0.9660068154335022, 0.9468357563018799]",positive,0.8807054758071899
Not Verified   British Airways has confirmed itself  the worst airline  the  Last minute cancellation  explanation refusal  book with another airline because  dont have  arrangement with them Whats happened  what used   our national airline,"['booking problems', 'staff attitude', 'flight delays']","[0.9672523140907288, 0.6248658895492554, 0.33528539538383484]",negative,0.9192458987236023
Trip Verified  Worst  experience  was supposed  fly out  Italy   September   arrived   Tambo International airport ready  check  bags   already checkedin online the previous evening   had  boarding pass ready  the counter  was told that  had been offloaded,"['baggage issues', 'booking problems', 'staff attitude']","[0.996849536895752, 0.9680846929550171, 0.9645876884460449]",negative,0.8218085765838623
Trip Verified    daughter and  were denied boarding  our business class flight from Madrid  Heathrow  March   the first leg  our return flight  Victoria Canada  reason was given for the denied boarding  the check  staff  the British Airways counter  Madrid,"['staff attitude', 'customer service', 'booking problems']","[0.9856394529342651, 0.969456672668457, 0.9582358598709106]",neutral,0.5501845479011536
Trip Verified  Despite boarding being the usual free for all  LHR with groups  being called  board all  once Whilst those passengers who had agreed  check   bag   the gate getting  board before anyone else However the service  board was impeccable Superb c,"['customer service', 'baggage issues', 'staff attitude']","[0.9835416674613953, 0.9097926020622253, 0.829992413520813]",positive,0.88873291015625
Not Verified   Flight cancelled  crew  September  not peak holiday period  why such bad management   Sent  the gate left standing  over and hour and then flight cancelled  were other  that day Why does  continue  provide such poor service   national disgra,"['flight delays', 'staff attitude', 'customer service']","[0.9949238896369934, 0.9640712141990662, 0.9409882426261902]",negative,0.9181314706802368
Not Verified   The worst service ever  baggage did not arrive  time Both  flights were delayed  will never fly them again  Even the food was bad and your service,"['baggage issues', 'flight delays', 'customer service']","[0.9992612600326538, 0.9951054453849792, 0.9760725498199463]",negative,0.9485899806022644
Trip Verified    flights  booked this holiday were delayed about  hours  wifi available     flights Food and drinks very basic and expensive Cannot recommend,"['booking problems', 'flight delays', 'food quality']","[0.9910224676132202, 0.9726083278656006, 0.3729036748409271]",negative,0.9150784015655518
Trip Verified   British Airways has  total lack  respect for its customers  was booked  fly from Frankfurt Main  London City Airport and just  couple  hours before the scheduled departure the flight was suddenly cancelled   without explanation when  was al,"['staff attitude', 'booking problems', 'customer service']","[0.997702419757843, 0.9745090007781982, 0.9360349774360657]",negative,0.8987393975257874
Trip Verified  London Heathrow  Keflavik Iceland  Business Class    British Airways provides  unusual Business Class experience for intraEurope flights The seating  similar  most airlines  middle seat vacant and little extra space  but  British Airways the,"['seat comfort', 'customer service', 'lounge experience']","[0.9461995959281921, 0.7464368343353271, 0.25933465361595154]",neutral,0.7950150966644287
Trip Verified  Mumbai  London Heathrow  Business Class   ageing  This aircraft featured the older Club World flatbed seats They are comfortable there  enough storage space around the cubicle and the monitor screen  among the larger ones Ive seen  airplanes,"['seat comfort', 'lounge experience', 'customer service']","[0.9955256581306458, 0.7453186511993408, 0.6093507409095764]",positive,0.516409695148468
Trip Verified   Care and support shocking Written   previously loyal  traveller Lies and misleading unprofessional service Told that  flight was cancelled Booked   next available flight  downgraded cabin from business  premium economy Called  ask why Told ,"['booking problems', 'staff attitude', 'flight delays']","[0.9748698472976685, 0.9655160903930664, 0.8943598866462708]",negative,0.9011738300323486
Trip Verified   Flying  business class should   pleasure but  has made   disaster with the worst seating and configuration imaginable How could any sane person could jam  many seats into  limited space and expect passengers   happy Seats are narrower than ,"['booking problems', 'staff attitude', 'customer service']","[0.920803427696228, 0.6849769949913025, 0.26752743124961853]",negative,0.8847943544387817
Trip Verified   British Airways absolutely does not care  reserved seat was change from  aisle  center seat for this overnight full flight and  was quite awful After enquiring  LAX check  the agent said sorry nothing  can  Onboard the flight the attendants,"['staff attitude', 'booking problems', 'customer service']","[0.9913327693939209, 0.9774370789527893, 0.829921543598175]",negative,0.9037299752235413
Trip Verified    recent experience with British Airways was not just horrendous  was  utter abdication  responsibility  their part  arrived  JFK ready for  flight  Malaga only  find  had been cancelled with zero notice After  draining hour altercation  was,"['staff attitude', 'flight delays', 'booking problems']","[0.9937500357627869, 0.9578239321708679, 0.9433262348175049]",negative,0.9081575870513916
Trip Verified   This   express our displeasure and concerns regarding our flight  Italy Our trip was effectively ruined  the failure  our luggage  arrive with  coupled with the length  time  took for   eventually reach   and  days Our departure dates June ,"['baggage issues', 'flight delays', 'booking problems']","[0.9749771356582642, 0.9119388461112976, 0.7408867478370667]",negative,0.8997783064842224
Trip Verified    flew London  Malaga   August  Club Europe  stood around  Gate   Terminal  for over  hour with staff giving very different reasons for the delay late inbound aircraft etc  but the plane  boarded had been sitting there for more than  hour Af,"['flight delays', 'staff attitude', 'customer service']","[0.9963563084602356, 0.9936075806617737, 0.9598467946052551]",neutral,0.7460486888885498
Trip Verified    arrived  the airport about  hours before takeoff  have more than about time  get checked   through security etc All that went without any issues Being that  was relatively early  the gate  was one  the first passengers there After some tim,"['customer service', 'staff attitude', 'lounge experience']","[0.9722521901130676, 0.7677332758903503, 0.730633556842804]",positive,0.5151969194412231
Trip Verified   Filthy plane cabin staff  appalling customer service staff who couldnt care less when dealing with  complaint Paid extra for club Europebusiness class Food was poor they gave you wipes  clean your seat area yourself and  were split   they c,"['staff attitude', 'customer service', 'food quality']","[0.9961503744125366, 0.9488339424133301, 0.3359324336051941]",negative,0.9339680671691895
Trip Verified    Chaos  Terminal  with  cancellations and delays and staff give different reasons depending  who you ask  out  answers were lies Sadly  airport standards   are worse than ever and  are long past being able  use Covid   excuse   short haul c,"['flight delays', 'staff attitude', 'booking problems']","[0.9849039912223816, 0.9690082669258118, 0.2943611145019531]",negative,0.9119783043861389
Not Verified    cancelled our flight and could not book  onto any flight for the next  days  had  spend   expenses  get  back with another airline  months later   still waiting for reimbursement and have had  response    written complaints Even the call ce,"['booking problems', 'flight delays', 'staff attitude']","[0.9972777366638184, 0.9922449588775635, 0.9049897193908691]",negative,0.8846819400787354
Trip Verified  When  our way  Heathrow Airport and merely  and  half hours before the scheduled departure  received  SMS stating that our flight  Johannesburg had been canceled   reason given  were then put  the same flight one day later with  other choice,"['booking problems', 'flight delays', 'customer service']","[0.9597396850585938, 0.941604733467102, 0.8588137626647949]",neutral,0.672687828540802
Trip Verified  Nice flight good crew very good seat food was what you would expect The aircraft had the new style Business Class seatssuite the actual plane  not new  any since  the word There were parts  the seat that were broken  missing however the seat,"['seat comfort', 'food quality', 'customer service']","[0.9652785658836365, 0.9550291895866394, 0.8704746961593628]",positive,0.8630433678627014
Trip Verified    months have passed and still wasting  time with the  team sharing the same documents again and again Our flight from Delhi  London got delayed  December    missed the connecting flight from London Heathrow  Vancouver  put    flight after  ,"['booking problems', 'flight delays', 'staff attitude']","[0.9848257303237915, 0.9838663935661316, 0.9707179069519043]",negative,0.8837794065475464
Trip Verified    June  flight was cancelled within three hours  departure Was given  rebooking the next day and they lost  suitcase  arrived three days later Today   August    happened again Offer  rebooking  two days When trying  post  claim the website d,"['booking problems', 'flight delays', 'baggage issues']","[0.9937202334403992, 0.9841461777687073, 0.9383485913276672]",negative,0.5848053097724915
Trip Verified   Ground and cabin crew always provide good customer service When  comes  catering Club Class has been reduced  what Economy was  flight  the ravioli pasta had dried out along the edges  slice  Camembert was dried why bother serving   bread r,"['customer service', 'food quality', 'staff attitude']","[0.9784395694732666, 0.9781588912010193, 0.8527052402496338]",neutral,0.5713532567024231
Trip Verified    family flew from Washington  London   British Airways   were able  secure seats  the upper deck for  pretty hefty fee Our flight was unfortunately delayed   hrs from    causing   miss  connection from Gatwick  Turin and making   that  loun,"['flight delays', 'booking problems', 'customer service']","[0.8993800282478333, 0.8293188810348511, 0.6377280950546265]",neutral,0.6606210470199585
Trip Verified   Easy check    Galleries south and North lounges packed only just able  get  seat Didnt stay long   gates lounge much quieter Flight boarded smoothly and  time  upper deck Old club world seating which  beginning  age  little However like the,"['lounge experience', 'customer service', 'seat comfort']","[0.8913784623146057, 0.8863381743431091, 0.6843668818473816]",positive,0.7170025110244751
Not Verified   Flight delayed   hour  happens  biggie Had  change our gate  the airport never happened before but  guess its  Gate agent asked   check our bags and after telling him  would prefer not   that  did  anyway Second gate agent reassigned our sea,"['flight delays', 'baggage issues', 'staff attitude']","[0.9952053427696228, 0.9894430637359619, 0.9825649261474609]",negative,0.5184224843978882
Not Verified  The staff are very rude and not trained properly  exceptions are made for children and elderly people The price  the ticket  very expensive given the distance and the service  extremely extremely poor,"['staff attitude', 'customer service', 'booking problems']","[0.9974284768104553, 0.9626079201698303, 0.7701740264892578]",negative,0.9348058104515076
Trip Verified   Good domestic flight operated   Cityflyer Ground service  checkin Edinburgh airport was particularly friendly and helpful The flight departed  time and arrived earlier than scheduled  complimentary drink and snack albeit tiny were served Ge,"['customer service', 'staff attitude', 'seat comfort']","[0.9903148412704468, 0.9365414381027222, 0.6867243647575378]",positive,0.9689993262290955
Not Verified  Failed  all basic travel fundamentals  Our flight was delayed  Staff demanded that  check  our carry  luggage even though  met our carry  allowance The fact that  have  tight bus connection was totally ignored  Staff were quite unpleasant,"['staff attitude', 'baggage issues', 'flight delays']","[0.998939573764801, 0.9981185793876648, 0.9956332445144653]",negative,0.8922930955886841
Trip Verified   They lost  baggage   very simple situation Its been three weeks and they dont care  communication whatsoever  was  the connection checkpoint  Heathrow hrs before  connecting flight the last leg   trip  agent insists  checking   hand luggage,"['baggage issues', 'staff attitude', 'customer service']","[0.9891659617424011, 0.9658204317092896, 0.7587244510650635]",negative,0.8822834491729736
Trip Verified   Late boarding led   one hour flight leaving two hours late  single  staff member turned   board  full flight shortly before the flight was due  depart There had been  previous announcement  the delay Once  board the captain blamed Frankfurt,"['flight delays', 'staff attitude', 'booking problems']","[0.8033179640769958, 0.7919597625732422, 0.5247834324836731]",negative,0.7050336599349976
Trip Verified   usual the flight  delayed  try  blame someone for the inability and incapacity  delivering what they sell Why dont you hire enough personnel  fulfil your staff demand,"['flight delays', 'staff attitude', 'customer service']","[0.9897414445877075, 0.8670617341995239, 0.8349403142929077]",negative,0.8888896703720093
Trip Verified    had the most fantastic  Flight today The cabin crew   seat zone  were  the best  have experienced Although the  had the old style rearfront seating   was comfortable and felt open and spacious  have done great things with the menu   was ni,"['seat comfort', 'customer service', 'food quality']","[0.9594674110412598, 0.9507188200950623, 0.9201759696006775]",positive,0.9837468266487122
Trip Verified   Couldnt book  online Arrived  check   find  had been bumped off due  overselling   staff available Very helpful Gatwick staff got   bus  LHR and  flight  Toulouse Had knock  effect  our car booking and sharing  the rest  family had been abl,"['staff attitude', 'booking problems', 'flight delays']","[0.941158652305603, 0.9336277842521667, 0.8521314263343811]",negative,0.5139016509056091
Trip Verified  London Heathrow  Mumbai   Boeing   Business Class The lounge near Terminal  Gate   Heathrow was outstanding  its service and offerings  provides  just the right frame  relax  before boarding  the departure was delayed  almost  hours The   ou,"['lounge experience', 'flight delays', 'customer service']","[0.9949883818626404, 0.9827303886413574, 0.9758710861206055]",positive,0.8245822787284851
Trip Verified  Keflavk Iceland  London Heathrow     Business Class The journey got off   unpleasant note  the Business Class line  Keflavk was  long that  looked like  Economy Class checkin  took over  mins  get through There was  lounge access offered The,"['booking problems', 'lounge experience', 'flight delays']","[0.9101817011833191, 0.8783434629440308, 0.6963715553283691]",neutral,0.6300241947174072
Trip Verified  Terrible Experience with British Airways  booked  flight with   travel from Gibraltar  London Heathrow  May    flight was scheduled  leave     the afternoon  had originally planned  leaving  luggage  Heathrow upon arrival and travelling  vis,"['booking problems', 'flight delays', 'baggage issues']","[0.9842624068260193, 0.9467814564704895, 0.9191057682037354]",negative,0.8708035945892334
Trip Verified   airline that lives  their past glory and heading  future  crisis  British Airways   not joking  are  family   all  Business Class heading for  Norwegian and Arctic Cruise and they lost   our bags They will never see   any  their flights eve,"['baggage issues', 'booking problems', 'staff attitude']","[0.992937445640564, 0.9651125073432922, 0.8728852868080139]",negative,0.8847771286964417
Trip Verified   Checkin Desk rude and dismissive Flight late but seems the new norm One world emerald club world checkin Staff uncommunicative did not know what baggage allowance entitled  once raised politely became argumentative and accusatory,"['staff attitude', 'baggage issues', 'flight delays']","[0.9974681735038757, 0.9907038807868958, 0.9273714423179626]",negative,0.7996439337730408
Trip Verified   chose British Airways especially because  was going  travel with  niece and nephew and wanted everything  work well What  disaster First  took  two hours   the checkin online due   technical problem  also had  spend more than  minutes   cal,"['booking problems', 'flight delays', 'customer service']","[0.9861723184585571, 0.8184196949005127, 0.7455642819404602]",negative,0.6986680626869202
Not Verified   booked Premium Economy from INV  LAX via LHR They notified    cancelled flight   return journey and rebooked    flight that  connecting flight arrived too late for Then they cancelled  flight   journey  LAX They then cancelled the rebooked f,"['booking problems', 'staff attitude', 'flight delays']","[0.9974792003631592, 0.9822542667388916, 0.9624817967414856]",negative,0.681669294834137
Trip Verified   simple story with  unfortunate outcome that really could happen  anyone  partner and  recently started working after studying purchased two tickets  travel from London City Airport  Frankfurt When  purchased the tickets  mistakenly entered ,"['booking problems', 'customer service', 'lounge experience']","[0.9791584014892578, 0.6610852479934692, 0.5903609395027161]",negative,0.6161037683486938
Trip Verified   Flight was delayed due  the inbound flight arriving late There was  announcement  inform  the delay nor were the sceens updated When ready  board  were requested  take our seats quickly  help reduce the delay which people did The pilot then,"['flight delays', 'customer service', 'staff attitude']","[0.9833198189735413, 0.823183000087738, 0.5783664584159851]",negative,0.6136656999588013
Not Verified   Fast and friendly check  total contrast  Gatwick The contract lounge  comfortable and spacious with  bar and pleasant staff but you have  pay for alcohol after the one free glass  wine Food best avoided  board great crew and dinner was actua,"['lounge experience', 'customer service', 'staff attitude']","[0.922441303730011, 0.8523180484771729, 0.7019919753074646]",positive,0.5082040429115295
Trip Verified    dont understand why British Airways  classified    star airline The service  really mediocre The food  untasty and insufficient for  long haul trip Some members  the cabin crew are friendly but they are not attentive enough and create  ver,"['customer service', 'staff attitude', 'food quality']","[0.833206057548523, 0.7959517240524292, 0.41491737961769104]",negative,0.9290513396263123
Not Verified    sure that  have gradually made their economy experience  Euroflyer out  Gatwick  miserable that passengers are tempted  upgrade  the lacklustre and overpriced business class Long wait  the biz checkin  due  status  and dealt with   bored ag,"['staff attitude', 'customer service', 'flight delays']","[0.7665566205978394, 0.5466472506523132, 0.4633104205131531]",negative,0.8764846920967102
Trip Verified   Customer Service does not exist One world emerald frequent long haul flyer including   never seen such poor customer service  computer says  Official BAcom site said all morning and afternoon that flight from Gatwick delayed  hours Delayed ,"['flight delays', 'booking problems', 'staff attitude']","[0.9269542098045349, 0.8921608328819275, 0.8283466100692749]",negative,0.8823241591453552
Trip Verified  Another really great pair  flights  time  problems  all champagne was  and  meal choices were great the new club suite   good improvement over the previous seat  flight entertainment could have been better cant wait  fly with  again and enjo,"['customer service', 'food quality', 'lounge experience']","[0.9475298523902893, 0.8213019371032715, 0.7790047526359558]",positive,0.9806278944015503
Not Verified   Our  developed  fault taxiing  the runway   returned  the gate only  then have the flight cancelled about  hours later due   technical fault All the while  staff were virtually nonexistent  was finally the captain who announced the flight wa,"['flight delays', 'staff attitude', 'customer service']","[0.9946447014808655, 0.9595383405685425, 0.9389705657958984]",negative,0.8767275214195251
Not Verified  Horrible airline Does not care about their customers Used   decent but has now since really fell off  flight time   hours and  mins but  meal while the flight attendants were having their eggs and sausage  the back Didnt even offer juices  wo,"['staff attitude', 'customer service', 'flight delays']","[0.9868497848510742, 0.9454609751701355, 0.8589497208595276]",negative,0.9313251972198486
Trip Verified    family and  have flown mostly  British Airways for the last  years    priority passenger and fly often enough  recognise cabin crew and know some  name They used    really good airline  fly with Things have really deteriorated with their f,"['staff attitude', 'customer service', 'booking problems']","[0.7807375192642212, 0.7467988729476929, 0.47818902134895325]",neutral,0.5464895367622375
Trip Verified   This has been  far the worst service  have had   plane Its very obvious that  you are flying economy and not  frequent traveler  British Airways they care very little about you  had  wait  hour for them  even open the checkin Once they did ,"['staff attitude', 'booking problems', 'customer service']","[0.9933425188064575, 0.9896936416625977, 0.9185777902603149]",negative,0.9327837228775024
Trip Verified    Nov   booked and paid for  return journey  New Zealand   return journey  final flight was from London  Edinburgh  trying  check   was told  ticket did not exist  showed evidence   flight being booked and paid for but was denied  ticket  on,"['booking problems', 'staff attitude', 'customer service']","[0.9935240149497986, 0.9774814248085022, 0.9449371099472046]",neutral,0.7141637206077576
Not Verified    not treating its premium economy passengers with respect You pay for  premium economy service and are then compelled  use the economy toilets  the back  the plane This  shortchanging passengers,"['staff attitude', 'booking problems', 'customer service']","[0.9973744750022888, 0.9669833183288574, 0.9570609927177429]",negative,0.8819609880447388
Trip Verified    hours before our departure    Cape Town from Heathrow  Thursday  June  did  online checkin Seats had already been allocated for  wife and     and   which are the middle two seats  the central block  four These were totally unsuitable for  ,"['booking problems', 'staff attitude', 'customer service']","[0.8659720420837402, 0.6328070759773254, 0.46034491062164307]",negative,0.7492313981056213
Trip Verified    arrived  Heathrow    find our flight  Ibiza was cancelled   with  explanation   that wasnt galling enough the customer service from   the airport was nonexistent There was  explanation  apology and  assistance  finding  alternative flight ,"['staff attitude', 'booking problems', 'flight delays']","[0.6965051889419556, 0.4270980954170227, 0.13777253031730652]",negative,0.8252968788146973
Trip Verified   Original flight was cancelled with  explanation There was  representative  help  rebooking  had  call customer service long distance call The line kept dropping Had     calls  find new booking only  discover the only way  could fly the next,"['booking problems', 'flight delays', 'customer service']","[0.9924134016036987, 0.9707486629486084, 0.9420976042747498]",negative,0.7163763642311096
