review,aspects,scores,sentiment,sentiment_score
Trip Verified   This review  specifically about Maddie crew member who took care   She was attentive warm friendly and nothing was too much trouble Smiling from start  finish She should  the brand ambassador for,"['customer service', 'staff attitude', 'lounge experience']","[0.9936057925224304, 0.9665883183479309, 0.7830604314804077]",positive,0.8761488795280457
Trip Verified    hours   cramped single aisle aircraft  inflight entertainment  economy there   free catering other than  bottle  water  packet  crisps and  minimal selection  food items for purchase,"['flight delays', 'staff attitude', 'food quality']","[0.19953592121601105, 0.0754232108592987, 0.07017708569765091]",neutral,0.8284481167793274
Not Verified   DFWLHR Had  easy transfer  DFW from American Airlines  British Airways heading  London First ride    left  with the feeling that this plane type wont ever   first choice Was seated upstairs where the cabin space seemed very roomy but the sea,"['booking problems', 'seat comfort', 'staff attitude']","[0.5111777186393738, 0.3821312487125397, 0.29987651109695435]",negative,0.6671445965766907
Trip Verified   Check   Jersey straightforward There   small business class lounge  Jersey with reasonable drinks range and some limited food Flight boarded  time but take off was delayed due  poor visibility  LHR Captain kept  well informed and  eventuall,"['lounge experience', 'customer service', 'flight delays']","[0.9763874411582947, 0.9582449197769165, 0.9569405913352966]",neutral,0.6901703476905823
Trip Verified   Check   LHR  was very quick and queue for security short  used the South Lounge which was supposed   the quieter  the time but was very busy and difficult for our group    get seated together Flight boarded  time Whilst this  only  short fl,"['lounge experience', 'staff attitude', 'customer service']","[0.8304094672203064, 0.814893364906311, 0.5823060870170593]",neutral,0.7516959309577942
Trip Verified  The checkin process was smooth  got access  the IGA Lounge which was nice but not  nice has the Turkish Airlines Lounge  board was what all this flight was about This was  first time flying IntraEuropean Business Class and though  was well p,"['lounge experience', 'customer service', 'seat comfort']","[0.9492828249931335, 0.9420437812805176, 0.5928914546966553]",neutral,0.5129103064537048
Trip Verified  This   first time flying BAs new Club Suite which   opinion  very good Flight  the  including mine departed from concourse   Terminal  which did not have many shopping  dining options However  was quiet  finding seating was quite easy The hi,"['customer service', 'seat comfort', 'food quality']","[0.8782696723937988, 0.8676249384880066, 0.6874668598175049]",positive,0.7622074484825134
Trip Verified     flight for  conference  June was cancelled with less than  notice  without being given any alternative flight  rebook  upon alternative flight Upon calling customer service customer service who said she can only get   flight  days later T,"['booking problems', 'staff attitude', 'flight delays']","[0.9977859258651733, 0.994963526725769, 0.9924318194389343]",negative,0.7129769325256348
Not Verified    would like  thank all the air and cabin crew for having the best experience with  very long journey  dont know how you manage  keep smiling Couldnt fault anything Helpful reassuring excellent food and  cant wait  fly again Thank you and  re,"['customer service', 'staff attitude', 'food quality']","[0.9857379198074341, 0.9455701112747192, 0.8837430477142334]",positive,0.9739630222320557
Trip Verified   British Airways personnel was just magnificent  flight into London was delayed security had long lines  ran like  madman  find the gate closed but the plane was still there the lady  the gate worked the computer   miles  hour  allow   board,"['customer service', 'flight delays', 'staff attitude']","[0.9973039031028748, 0.9942070841789246, 0.9679514765739441]",neutral,0.45844829082489014
Not Verified   Good flight apart from  seat fabric was coming apart onJ and lack  good leg room Meal was good from Singapore Should  more snacks  board  neighbours passenger charger and headphone socket didnt work,"['seat comfort', 'food quality', 'customer service']","[0.5278475284576416, 0.3508177101612091, 0.3468188941478729]",negative,0.418031245470047
Trip Verified   Flight was  hour late leaving gate Crew were friendly Seats comfortable But the complimentary snack provided was  bag  ready salted crisps,"['flight delays', 'customer service', 'seat comfort']","[0.9916238784790039, 0.9824882745742798, 0.9812592267990112]",neutral,0.6385995745658875
Trip Verified   London  Istanbul British Airways Business Class rows comprise  three seats with the middle seat empty Front rows about  are considered  Business Class with very short leg space   pillows  blanket horrible inflight service staff were harassi,"['staff attitude', 'customer service', 'seat comfort']","[0.9256749749183655, 0.6061554551124573, 0.36061885952949524]",negative,0.6694875955581665
Not Verified  London  Manchester British Airways  probably the worst air company  have ever flown with they took  hours  unload the luggage and the flight was delayed   hour The staff were  help and frankly rude,"['staff attitude', 'flight delays', 'baggage issues']","[0.989959180355072, 0.9747614860534668, 0.9196224212646484]",negative,0.9374415874481201
Not Verified   Flight was cancelled  the last minute due  weather despite pretty much all other flights not being affected Booked onto  flight the next day Arrived  the airport  hours ahead  Horrendous checkin and security delays meant  almost missed the n,"['flight delays', 'booking problems', 'customer service']","[0.9872002005577087, 0.9849850535392761, 0.8172635436058044]",negative,0.883742094039917
Trip Verified   After having  few not  good experiences  the past  feel  have  write  positive review  well where   deserved First  all the improvement  the  lounge  Gatwick  massive The buffet was  joy  flew    flight but operated  Iberia Express Wonderfu,"['lounge experience', 'customer service', 'food quality']","[0.9295303225517273, 0.8363600373268127, 0.48655301332473755]",positive,0.9108595252037048
Not Verified   This review  for  booking system not  flight  Today  clicked wrong date  line  mistake and expect  pay  fee  then   cancel booking and click  the option  not receive  voucher immediately  received  response saying  voucher   its way  call th,"['booking problems', 'customer service', 'staff attitude']","[0.9927184581756592, 0.41605907678604126, 0.3669811189174652]",negative,0.8091215491294861
Trip Verified   Manchester  Seattle via London  will never fly  again They cancelled  return flight from Heathrow back  Manchester and then cancelled the alternative offered  had  get our son come all the way  London  pick   and take   our car  Manchester ,"['staff attitude', 'booking problems', 'flight delays']","[0.9930863380432129, 0.9887077808380127, 0.9701241850852966]",negative,0.7833192944526672
Trip Verified   Our flight  March  from San Francisco  London   March was cancelled with  hours notice  found out  the shuttle bus  the airport  had  stay overnight for the next day flight  still have not been recompensed for our expenses filled   line and,"['booking problems', 'flight delays', 'customer service']","[0.9950158596038818, 0.989081859588623, 0.8531442284584045]",negative,0.7851728200912476
Not Verified    sat  seat  Our Cabin Crew lady was called Gina and she went above and beyond  keep the customers happy She greeted    boarded with  very cheery smile she engaged with two families travelling with young children and gave out games and books ,"['customer service', 'staff attitude', 'lounge experience']","[0.9957590103149414, 0.9939722418785095, 0.8152880668640137]",positive,0.8874040842056274
Trip Verified   Full afternoon flight Ready  fly  time Arrived early Uneventful flight Good service Pre dinner drinks Drink with meal Coffee Drinks available  back AVML meal was tasty Hard working crew   full flight Audio worked well,"['customer service', 'food quality', 'staff attitude']","[0.9892760515213013, 0.9725928902626038, 0.9359439611434937]",positive,0.9512680768966675
Trip Verified    was told  require    negative covid test for entry into Philippines Booked  trip via BAcom with  transfer  Singapore They delay  transfer  the next day okay not too bothered  have    negative covid test but when  try  check   Changi Airpor,"['staff attitude', 'booking problems', 'customer service']","[0.9873297214508057, 0.9859467148780823, 0.9516170024871826]",neutral,0.5749948024749756
Trip Verified   Having been promised help  find  hotel room after  outgoing flight from Heathrow was running very late and  hotel would  closed  boarded the plane  this basis  was subsequently dumped  Barcelona airport    sleep the night  the floor There w,"['booking problems', 'staff attitude', 'flight delays']","[0.9940714240074158, 0.9716314673423767, 0.969131588935852]",neutral,0.4905518889427185
Trip Verified      business class customer British Airways cancelled  return flight and chose  alternative flight with  stops After  complained they changed the date When  told them the date would not work they attempted  charge  additional  for the change,"['booking problems', 'staff attitude', 'customer service']","[0.9879297614097595, 0.9762111902236938, 0.9111942648887634]",negative,0.6987885236740112
Trip Verified   Barbara Collins was super helpful  boyfriend   booked flights separately thinking  were  the same one but  found out  check  that  was  separate slightly later one Barbara was able  make some changes  ensure  flew together  even managed  pu,"['booking problems', 'customer service', 'staff attitude']","[0.985876202583313, 0.9847169518470764, 0.9745206832885742]",positive,0.7199952006340027
Not Verified    husband parents who are  their  and  were traveling back   from Naples Italy and had  stopover  Heathrow London Let  just say  were not happy when  arrived late  London and missed our connecting flight back   The reason writing this review ,"['flight delays', 'booking problems', 'baggage issues']","[0.9949938058853149, 0.9933599829673767, 0.8628250360488892]",negative,0.7488270998001099
Not Verified    our recommendation  son and his young family child  and baby  months and wife flew   the USA from Cape Town leaving yesterday evening Just got off the call with him after their arrival  Heathrow Shocked  what  told   the cabin service provi,"['customer service', 'staff attitude', 'booking problems']","[0.8478603363037109, 0.8256505727767944, 0.5952619314193726]",negative,0.7642712593078613
Not Verified    had  nice flight pushedoff exactly  time Cabin crew very efficient  all things friendly for the most part  well Dinner hot and complimentary wine served  premium economy very good  avoid middle seats though even  premium economy Only issue ,"['customer service', 'seat comfort', 'staff attitude']","[0.8114349246025085, 0.6820192933082581, 0.6233161687850952]",positive,0.8951777815818787
Trip Verified   Holidays ruined  suitcases lost   flights  travelled from London Heathrow  Amsterdam with  brother before boarding  were told  couldnt take our cabin suitcases with   the cabin  they sent them  the cargo  our arrival  Amsterdam one  the sui,"['baggage issues', 'booking problems', 'staff attitude']","[0.9978154301643372, 0.9763907194137573, 0.9701564311981201]",negative,0.8648627400398254
Trip Verified  Despite BAs promise  credit double tier points for  holiday booked  their website  have received  additional points and  four email communications including  the Chief Executive have remained unanswered  not  taken   this marketing con  they,"['booking problems', 'staff attitude', 'customer service']","[0.9334684610366821, 0.8614360094070435, 0.18991988897323608]",negative,0.5487379431724548
Trip Verified   Refund process  non responsive  have been following    refund since October  which   months now  have contacted the customer service deck and sent mails  email protected several times and all they tell   its been processed British Airways c,"['staff attitude', 'customer service', 'booking problems']","[0.9754990935325623, 0.9560413360595703, 0.4861658811569214]",negative,0.8395971059799194
Trip Verified   Customer service  nonexistent For over  week customer service number message said  call back   couple weeks Nothing  needed  accomplish could  done  BAcom  was flying  Nairobi  bring  sister back after her husband died suddenly  sister and ,"['staff attitude', 'customer service', 'booking problems']","[0.9856178760528564, 0.8782980442047119, 0.6708354949951172]",negative,0.8596418499946594
Trip Verified   Flight   SFO  LHR Smooth check   San Francisco Airport quiet and efficient Dedicated  lounge excellent food and beverage options and attentive staff Lounge was very crowded though Minor departure delay and onto  upper deck  prefer the club ,"['lounge experience', 'customer service', 'staff attitude']","[0.959538459777832, 0.9382612109184265, 0.6492377519607544]",positive,0.9298338890075684
Trip Verified   For this  hour  min flight you are given  bag  potato chips and  bottle  water  you want  purchase more food and drink you  this via their app  your phone  like  you can preorder weeks before you fly However there   guarantee you will get y,"['customer service', 'food quality', 'lounge experience']","[0.9662440419197083, 0.7202484011650085, 0.7016804814338684]",neutral,0.8108097314834595
Trip Verified    wife and  booked  flight  April  that included  return trip from Edinburgh thru London  Washington When  checked   Edinburgh Airport  hours ahead  time  were informed there were  more seats available  our scheduled flight  asked how this w,"['booking problems', 'customer service', 'staff attitude']","[0.9752559661865234, 0.9465075135231018, 0.9128535985946655]",neutral,0.8775242567062378
Not Verified   Decent flight and airplane non existing customer service for refunds and support after delayed flight Flight   June from Vancouver  London airport was delayed for roughly  hours  received   CAD voucher for some drinks this was appreciated Be,"['flight delays', 'customer service', 'staff attitude']","[0.9976434111595154, 0.9817934036254883, 0.9151607751846313]",negative,0.5720755457878113
Not Verified   Reasonably smooth boarding Meal service was smooth  efficient but  ice  spirits available   room  the trolley  could they have offered  serve this afterwards Seat was very uncomfortable indeed  this aircraft  got little  any sleep  the long ,"['customer service', 'staff attitude', 'food quality']","[0.7646727561950684, 0.5684407353401184, 0.38483932614326477]",negative,0.7039502859115601
Trip Verified   Three flights London  Reykjavik return and Frankfurt  London Generally the flights were   acceptable standard though the seats and legroom are quite tight for  threehour flight The cabin crews were efficient and generally friendly  big plus,"['staff attitude', 'customer service', 'seat comfort']","[0.9858787655830383, 0.9665045142173767, 0.8882404565811157]",positive,0.8988983035087585
Trip Verified  Routine typical  domestic shuttle flight Nothing special Departure five minutes early but  one  greet flight upon arrival hence   minute delay Crew were attentive and charming Usual clean cut  product that when  works well  fine,"['flight delays', 'customer service', 'staff attitude']","[0.9818134307861328, 0.9693046808242798, 0.9098584055900574]",neutral,0.5846475958824158
Trip Verified   Over  week ago  cancelled  Club Europe flights due  testing positive for Covid the day before They were booked many months ago and eligible for the Travel Voucher   opted for this online Since then absolute silence and  pages state  might t,"['booking problems', 'flight delays', 'customer service']","[0.965042233467102, 0.7429797053337097, 0.6965977549552917]",negative,0.7433898448944092
Not Verified   Flight delayed slightly due  luggage conveyor breaking down Luggage never made   Toronto and  filed  lost baggage report Within  hours our luggage arrived  Toronto and  wonderful  representative went down into the baggage loading area  retri,"['baggage issues', 'flight delays', 'customer service']","[0.9061480760574341, 0.7836612462997437, 0.6653486490249634]",negative,0.7809361219406128
Trip Verified   Check  and security  LHR efficient Went  Galleries North which was busy but fine with good service Left from  gates Efficient boarding with welcome drinks and menus This was  first time  the club suite Travelling with  children  moved our s,"['customer service', 'food quality', 'lounge experience']","[0.9839237332344055, 0.8367712497711182, 0.8129720091819763]",positive,0.8431229591369629
Trip Verified  Washington  London Our flight was unexpectedly cancelled  husband spent hours  the phone  the middle  the night  try and rebook our flight  were told  the customer service representative that  should just cancel our trip after spending thous,"['booking problems', 'flight delays', 'staff attitude']","[0.9994615912437439, 0.9982120990753174, 0.997939944267273]",negative,0.7994030117988586
Not Verified  Nairobi  New York via London British Airways has given  such grief trying  cancel  ticket for  uncle who passed away they canceled  ticket instead for  newly widowed aunt after they split her booking off the original booking   now less than t,"['booking problems', 'staff attitude', 'customer service']","[0.9978688955307007, 0.9900281429290771, 0.9508336782455444]",negative,0.8628474473953247
Not Verified   Today  husband and  friend flew from Dublin  London City Airport All apparently went well from checkin through the flight After that the ineptitude and lack  systems seemed    full bloom  waited and waited for our bags  come off the baggage ,"['baggage issues', 'flight delays', 'staff attitude']","[0.9967066049575806, 0.9610892534255981, 0.9234371185302734]",negative,0.7742941975593567
Not Verified   British Airways  poorly staffed  Venice airport  one  check   flights departing within  minutes  each other  hours before Huge line snaking through airport Flight crew fine London  Baltimore segment   older  usually they are much nicer Limit,"['staff attitude', 'booking problems', 'customer service']","[0.8523204922676086, 0.3842352032661438, 0.32551872730255127]",negative,0.8568349480628967
Not Verified    booked  flight for myself and  wife from Heathrow  Nairobi  Premium Economy using Frequent Flyer points  then paid   reserve two seats  our own    configuration cabin   didnt want  sit   row   people  possible  few weeks before our flight  ,"['booking problems', 'seat comfort', 'customer service']","[0.9849762916564941, 0.8297199606895447, 0.6525200605392456]",negative,0.6654685735702515
Trip Verified   Departure was about  minutes late The   flew  was about eighteen months old The seating spacing  economy class seems very tight and  the seat  front  fully tilted back    real challenge  get out  the seat The screen becomes  close  your fac,"['flight delays', 'booking problems', 'customer service']","[0.8068807125091553, 0.5286188125610352, 0.29816800355911255]",negative,0.5531802177429199
Not Verified   Was going from Belfast  London but they cancelled the flight and  didnt even know  was cancelled Someone behind  had  tell   had  connecting flight and spent  lot  money  our holiday the refund takes ages Overall not happy  all,"['booking problems', 'flight delays', 'staff attitude']","[0.9994937181472778, 0.9984608888626099, 0.9876390099525452]",negative,0.9004967212677002
Not Verified   Second time getting poor service from   unable  contact via phone email  website  even with four business class tickets across the Atlantic they  not allow free seat selection  check  until  hours prior  the flight  they understand what the ,"['booking problems', 'staff attitude', 'customer service']","[0.9980880618095398, 0.9972644448280334, 0.988476574420929]",negative,0.8990400433540344
Not Verified   Booked  flight from London  Paris  Trip was cancelled due  Covid lockdowns  asked  staff for refund told cannot  but will issue vouchers  stated  good for two elderly people from Australia  would not know when  can travel Informed  other opt,"['booking problems', 'staff attitude', 'flight delays']","[0.9935411810874939, 0.9809861779212952, 0.9762125015258789]",negative,0.8272050619125366
Not Verified    left MIA late due   issue with the provisioning  the plane  arrived late and  missed our connection  LHR  CDG  LHR British Airways rebooked   not  but  flights  CDG and  such said  never took the flight  CDG and then cancelled  flight back ,"['flight delays', 'booking problems', 'staff attitude']","[0.9494443535804749, 0.9372058510780334, 0.5503950715065002]",negative,0.7940360903739929
Not Verified   The flight was delayed over  hours and this  course caused   missed our connection flight and change   different route finally  lost  luggage and  one has any information  will never again travel with British Airways,"['baggage issues', 'flight delays', 'staff attitude']","[0.9988866448402405, 0.9986931085586548, 0.98268723487854]",negative,0.9291503429412842
Not Verified   Terrible experience with British Airways  was obligated  checkin  carryon suitcase due   group number according  the girl  the front desk Then they could miss  two suitcases plus the luggage   boyfriend who traveled with  After  days they de,"['baggage issues', 'staff attitude', 'booking problems']","[0.9947012066841125, 0.9793799519538879, 0.9634947180747986]",negative,0.8766597509384155
Trip Verified    cancelled  flight  never got   couldnt book another and refunded about  quarter  what  spent despite their covid guarantees   was booked onto  flight with  for April   from Hong Kong  London They cancelled the flight   looked  rebooking fo,"['booking problems', 'flight delays', 'customer service']","[0.9972625970840454, 0.9852008819580078, 0.9467476010322571]",negative,0.8312641978263855
Trip Verified   Belfast  London   Jun   was informed  about  flight  has been delayed   will only reach London Heathrow    reached the airport   but  counter was only open    checkin counter  approached  ground staff for advice   have  connecting Singapore,"['flight delays', 'staff attitude', 'customer service']","[0.9880412220954895, 0.9762992858886719, 0.9514384865760803]",neutral,0.5634394884109497
Not Verified   The customer service  British Airways  really bad You cant reach any call centre agent even after waiting for  mins Now  really appreciate Emirates and Turkish Airlines after facing BAs low quality customer service Not only the customer serv,"['customer service', 'staff attitude', 'lounge experience']","[0.9904391765594482, 0.9470043778419495, 0.9099683165550232]",negative,0.932933509349823
Trip Verified    still charging premium airlines fares however delivering nothing better than what  low cost offers Seat does not recline legroom  minimal causing anyone taller than   torture  fly  being   sardine can Good old times  being  glamour flying ,"['booking problems', 'seat comfort', 'staff attitude']","[0.8862282633781433, 0.7022635340690613, 0.43447065353393555]",negative,0.8015182018280029
Trip Verified   This  new route which  introduced  the beginning  June after several years  Covid related delays The business class experience was  fear typical  the nickel  dime policies introduced  the airline over the past decade Plus  helpful and frien,"['customer service', 'seat comfort', 'staff attitude']","[0.8473069071769714, 0.7177918553352356, 0.6821155548095703]",positive,0.6222686171531677
Trip Verified     regular  customer  European flights   sad but true  note that standards continue  slip particularly ground service  LHR and the atrocious handling  delays Staff  the entrance  the First Wing was brusque  put  mildly rude   accurate Flight,"['staff attitude', 'flight delays', 'customer service']","[0.954449474811554, 0.9037899971008301, 0.8345311284065247]",negative,0.7876834273338318
Not Verified   Right now  not use British Airways When booking person said  would have enough time between the connection flight  final destination but  was wrong Flight  London was late  auto missed our flight  Edinburgh and had  wait  hours for the next ,"['booking problems', 'staff attitude', 'flight delays']","[0.997873067855835, 0.9914555549621582, 0.9896215200424194]",negative,0.8252382874488831
Not Verified    could very much understand losing  luggage for  days with how airports are doing This was  risk  was well aware about when travelling  Greece for  wedding However   many attempts  receive communication from this company  has been nothing bu,"['baggage issues', 'flight delays', 'staff attitude']","[0.9888029098510742, 0.5923702716827393, 0.49148643016815186]",negative,0.8454993367195129
Trip Verified   The    wonderful aircraft  quieter than any other aircraft Ive flown Flight was delayed arriving  Vancouver from London which meant that departing flight from Vancouver was also delayed Passengers waited almost  minutes  London Terminal  fo,"['flight delays', 'customer service', 'seat comfort']","[0.9905529022216797, 0.9526784420013428, 0.8756254315376282]",neutral,0.537787139415741
Trip Verified   LHR  SFO  new Club Suite Rather chaotic embarkation despite small number  passengers Pushback delayed  lack  tug Club Suite seats   huge improvement over previous  product with excellent IFE and  good range  movies Cabin crew attentive and ,"['lounge experience', 'seat comfort', 'customer service']","[0.922836184501648, 0.9096276760101318, 0.8589886426925659]",neutral,0.524186372756958
