review,aspects,scores,sentiment,sentiment_score
Not Verified   Currently dreading  flight with  considering they have hung    and mum  the customer service line twice now and will not reply via the  called Live Chat All  wanted  find out was how there were two flights booked under  mums name plus  fligh,"['booking problems', 'staff attitude', 'customer service']","[0.9940900802612305, 0.9661471843719482, 0.918941855430603]",negative,0.907752275466919
Trip Verified  Another  shuttle flight and  good one Fantastic flying weather and  would say   load factor Good professional crew Friendly and complimentary snack arrived early  now worries And getting  the  gates   makes for  easy exit Still  cut above th,"['customer service', 'staff attitude', 'lounge experience']","[0.9836028814315796, 0.8303385972976685, 0.6997274160385132]",positive,0.9728955626487732
Trip Verified  Flight from Larnaca  LHR Check  was  The lounge was  Aspire lounge and shared  was basic but  Flight left  minutes late but made  time  route There were  rows  the business class cabin  this  Service was  but  was quite expensive for the pro,"['lounge experience', 'customer service', 'flight delays']","[0.9088221788406372, 0.8938575387001038, 0.5340115427970886]",neutral,0.7931902408599854
Trip Verified   Upon checking   the Club desk  Lisbon airport our Passenger Locator Forms were found  have  incorrect reference number for our Day  test and the check  agent denied  boarding causing  wife who had recently spent some long time  hospital  th,"['booking problems', 'customer service', 'staff attitude']","[0.9651380181312561, 0.8482201099395752, 0.8120793104171753]",neutral,0.5571490526199341
Trip Verified  Club Europe  British Airways Outstanding and wonderful  have  back The welcome  board was warm and sincere Flight attendants helpful friendly and professional Great updates from the flight deck Super lunch and good choice  wines   its best H,"['customer service', 'staff attitude', 'food quality']","[0.9970349073410034, 0.9927915334701538, 0.9883227348327637]",positive,0.9835644960403442
Not Verified   Good flight but boarding was chaos was gifted with the beautiful  gate  LHR    were bussed  the plane first time Ive used  bus gate there The  was     gate with  jetway nevertheless  passengers full flight boarded via steps  this caused  hou,"['flight delays', 'booking problems', 'customer service']","[0.8679830431938171, 0.6817147135734558, 0.49994978308677673]",neutral,0.44955307245254517
Trip Verified   Usual  economy trip pleasant crew Complimentary snack and water and small bar service which has reasonable prices   not  fan  the new NEO aircraft Very cramped seating and uncomfortable The armrests between seats are tiny thin and short  le,"['customer service', 'staff attitude', 'seat comfort']","[0.7518568634986877, 0.5873692631721497, 0.37929901480674744]",neutral,0.41365763545036316
Trip Verified   Check  was easy security quick lounge fine Lounge service returning  pre pandemic days and some self service allowed which was great Flight was fine  wife and son felt breakfast was more like old style economy food and perhaps  agree There ,"['lounge experience', 'customer service', 'food quality']","[0.9785486459732056, 0.9649878144264221, 0.7340291738510132]",positive,0.9108616709709167
Not Verified   What has happened  British Airways The whole preflight experience now  prehistoric they appear  have gone back  the  and now make passengers physically queue  manually check  adding hours  the journey not  mention how ridiculous    bunch peo,"['staff attitude', 'flight delays', 'customer service']","[0.9890391230583191, 0.9759567975997925, 0.909989058971405]",negative,0.8295257091522217
Trip Verified    have just returned from  amazing holiday and felt compelled  write  review The flight  generally  torment for  being  nervous flyer however  this occasion  was  absolute delight  both inward and outward journeys  was impressed  the profess,"['customer service', 'staff attitude', 'lounge experience']","[0.7700861692428589, 0.5171899199485779, 0.417383074760437]",positive,0.9756301045417786
Trip Verified   The plane was clean and air quality very good Timing was perfect  was seated     begin with   had difficulty using the buttons  get the leg rest   well  push back the seat When  requested  cup  tea just  the drink service started  was told ,"['customer service', 'seat comfort', 'lounge experience']","[0.929659903049469, 0.9112508296966553, 0.6001144051551819]",positive,0.8542858958244324
Trip Verified   The service was excellent The cabin staff were attentive and efficient The food and drinks were very good The seat  the new suites  extremely comfortable and the additional privacy  really nice Overall  very enjoyable flight,"['customer service', 'seat comfort', 'food quality']","[0.9956598281860352, 0.9913307428359985, 0.9824510216712952]",positive,0.9851506352424622
Not Verified    booked and paid for what  thought was  business class seat   flight  Athens What  got was  premium economy seat The first nine rows were business class seats rows    were what should have been the premium economy cabin but had been added  t,"['booking problems', 'customer service', 'staff attitude']","[0.998573899269104, 0.9231839179992676, 0.9198047518730164]",neutral,0.6914992332458496
Trip Verified   Terrible customer service Booked  flight before Covid Couldnt  still cant   borders are still closed  wasnt given  option just told  have  take  voucher Now  have  job and  plans  travel and they refuse  give   money back although  booked f,"['staff attitude', 'booking problems', 'customer service']","[0.9979645609855652, 0.9979633092880249, 0.9908496737480164]",negative,0.9291881322860718
Trip Verified  This was  first flight during the pandemic   was understandable the difficulties facing airlines Checkin was longer than normal due  the vaccine checks and passenger locator forms etc But  the return flight  was  total mess Just two counters,"['flight delays', 'booking problems', 'staff attitude']","[0.9427973628044128, 0.719478964805603, 0.4782790243625641]",negative,0.7037330865859985
Trip Verified  LCA  LHR  Club Europe Quick checkin  LCA with speedy passport control and security Aspire lounge was clean and spacious with reasonable buffet food and drink Boarding  group and pushback  time  stretched back  full  rows and the single toile,"['lounge experience', 'customer service', 'food quality']","[0.9691001772880554, 0.948960542678833, 0.7732273936271667]",positive,0.847599446773529
Not Verified    had booked  flight from Heathrow  Friday  August   fly  Manchester Airport  arrival  Heathrow  check  the British Airways staff informed  that  had booked both flight seats   name  mistake  offered  pay  fee  get the second seat changed   s,"['booking problems', 'staff attitude', 'customer service']","[0.9977961778640747, 0.9817692041397095, 0.9616356492042542]",negative,0.5284975171089172
Trip Verified    have flown with  for many years and never will again where there   alternative Booked and paid for Club class flights Didnt receive  meal  drinks onboard crew were  unorganised  were delayed  the ground for  minutes prior  departing  they ,"['staff attitude', 'flight delays', 'booking problems']","[0.9771523475646973, 0.9194104075431824, 0.9021878242492676]",negative,0.7722915410995483
Trip Verified   The crew  Denver airport  top notch  impressed with their customer service They were very patient and courteous Thank you all for being amazing,"['customer service', 'staff attitude', 'flight delays']","[0.9987329244613647, 0.9940949082374573, 0.9307864308357239]",positive,0.9847905039787292
Trip Verified    ordinary  domestic shuttle flight from Belfast  London Heathrow Usually uneventful except for the cabin crew announcement three times advising people complete   passenger arrival form from the govuk website  risk prosecution Some people ch,"['staff attitude', 'customer service', 'lounge experience']","[0.8890835046768188, 0.5802266001701355, 0.17148330807685852]",neutral,0.6316841840744019
Not Verified   Ive had  book six flights with  recently All have either been cancelled  had  significant time change The latest flight was  late into Heathrow  missed our connecting flight even though wed scheduled around  hours between flights  staff  Hea,"['booking problems', 'flight delays', 'staff attitude']","[0.9993882775306702, 0.9977482557296753, 0.9553645849227905]",negative,0.8585304021835327
Trip Verified   The service  got super inconsistent   and the management  our diverted flight was unprofessional and lacked any shred  empathy The flight down from London  was  business class  asked for the mini bottle  champagne that  always treat myself ,"['staff attitude', 'customer service', 'flight delays']","[0.9800169467926025, 0.7844265103340149, 0.7761308550834656]",negative,0.8820415139198303
Trip Verified  Such terrible service  Club World Such indifference and lackadaisical attitude Hardly any service Everything has   asked for and gotten Asked for  cup  tea and had the flight saywhaa and then when  said cup  tea she said yesasked  wanted mil,"['staff attitude', 'customer service', 'lounge experience']","[0.9868965148925781, 0.9498945474624634, 0.46513351798057556]",negative,0.9042124152183533
Trip Verified   LHR  LCA Galleries Lounge chockablock first thing   Wednesday morning and  seemed  bustling  prepandemic Boarding  groups efficient and flight almost full Superficially the cabin seemed clean although long hairs  pillows gave the game away ,"['lounge experience', 'customer service', 'seat comfort']","[0.8862726092338562, 0.813986599445343, 0.5455137491226196]",positive,0.8254841566085815
Trip Verified   Very pleasant flight  Lisbon  was  full flight and  left about min late   were taken  the aircraft  bus  Heathrow and the gate staff allow too much hand luggage  the aircraft However  the air great service  the  male crew   big Club class c,"['customer service', 'staff attitude', 'seat comfort']","[0.9772584438323975, 0.9241735339164734, 0.8671271204948425]",positive,0.9241865277290344
Trip Verified   check  staff for Economy Never experienced this before While Business passengers strolled  Economy passengers were left standing for  mins plus,"['staff attitude', 'customer service', 'flight delays']","[0.9546157717704773, 0.8658809661865234, 0.3201857805252075]",neutral,0.601512610912323
Trip Verified    refund for flights cancelled  months ago but provided  ticket voucher valid until  April  Tickets bought  Edreams  June   for  flight  July   from Geneva   Paulo through London British Airways round trip The LHRGRU flight was cancelled wit,"['booking problems', 'flight delays', 'customer service']","[0.9605673551559448, 0.926084041595459, 0.8329702615737915]",neutral,0.9165272116661072
Trip Verified   Stranded  the lounge because  wasnt allocated  seat This for  flight that  booked months ago  didnt want  use them but was forced  because Emirates wasnt available  advise travelers  shun them too and look for more customer friendly options,"['lounge experience', 'booking problems', 'staff attitude']","[0.9870374202728271, 0.9752915501594543, 0.7096396088600159]",negative,0.7716177105903625
Trip Verified    think British Airways needs   much clearer about what their Covid travel flexibility really means because  doesnt pass the commonsense test  purchased  roundtrip business class ticket from New York toandfrom Mykonos through London  travele,"['booking problems', 'customer service', 'staff attitude']","[0.9711682796478271, 0.5256016254425049, 0.44176965951919556]",negative,0.6261783242225647
Trip Verified    flight from Boston  Heathrow arrived  time but  and other passengers were not allowed  disembark the plane  were kept  the tarmac for one hour and  half without being given sufficient information about what was causing this delay Because  ,"['flight delays', 'staff attitude', 'customer service']","[0.9965288043022156, 0.9766678810119629, 0.7947626113891602]",negative,0.7082140445709229
Trip Verified  Year after year the British Airways  service  the same route WashingtonLondon  becoming worse  just had one bad experience after another  this route  July   British Airways  notified  that our connection flight  Nice was bumped from      had,"['booking problems', 'flight delays', 'customer service']","[0.9328901767730713, 0.9230332970619202, 0.6900734901428223]",negative,0.8840905427932739
Trip Verified    used      carrier and    silver member However their service seems  have gone hugely downhill Flights get cancelled the best alternative flights are offered and whilst  theory you can cancel  amend bookings online   the app invariably this,"['booking problems', 'customer service', 'flight delays']","[0.9934112429618835, 0.9547664523124695, 0.9450105428695679]",negative,0.833087682723999
Trip Verified   The entertainment system was working badly the screen was freezing every time  wanted  open flight map Though the aircraft was  years only the window blinds worked with delays The crew informed passengers that there would   headphones provi,"['flight delays', 'staff attitude', 'customer service']","[0.8994076251983643, 0.7241235971450806, 0.6321285367012024]",negative,0.8698413968086243
Trip Verified    flew  British Airways Cheapest Fare which was  Hand Baggage Only fare  Economy Class Despite this being the cheapest fare you can actually carry two pieces  cabin luggage both weighing    each The value for money here  incredible The groun,"['baggage issues', 'customer service', 'lounge experience']","[0.77409428358078, 0.7439988255500793, 0.40302199125289917]",positive,0.8850047588348389
Trip Verified   Very efficient evening bag drop Security quick Galleries North lounge was very good Food and drinks fine Plane left  time pre ordered door was  Early arrival Fortunately only our bags were not given priority tags and came out early,"['customer service', 'food quality', 'lounge experience']","[0.9493207931518555, 0.9086000919342041, 0.8933515548706055]",positive,0.9508132338523865
Trip Verified    and   year  months baby girl flew business class from Moscow Domodedovo  London Heathrow   august When  landed  Heathrow  baby was sleeping  asked stewards for  stroller and they said   going  wait for   the and  the corridor before entran,"['staff attitude', 'customer service', 'seat comfort']","[0.9749473929405212, 0.949963390827179, 0.5056894421577454]",neutral,0.9234002232551575
Trip Verified   For this flight from Heathrow  passengers were piled into the bus and left for  mins  the terminal  Very unhappy passengers  and when confronted the  transport managers response was sorry   are still learning  arrival  the aircraft  gentlem,"['staff attitude', 'flight delays', 'customer service']","[0.9907215237617493, 0.980287492275238, 0.9532175660133362]",negative,0.8762248754501343
Trip Verified   encourage you  download verifly  speed  your checkin this  absolutely rubbish  the desk staff dont seem  want this they want  see the actual forms tests etc This wasted about  minutes and  pointless The return flight again had  access  the ,"['staff attitude', 'customer service', 'booking problems']","[0.9849787950515747, 0.23037788271903992, 0.12177510559558868]",negative,0.9140138626098633
Trip Verified   They cancelled  flight  booked three months ago for some operational problem   time where the prices are off the roof British Airways could not give  any alternatives other than refund   voucher,"['booking problems', 'flight delays', 'customer service']","[0.971435546875, 0.904029130935669, 0.8359501361846924]",negative,0.8739804625511169
Trip Verified   Ive been flying with  for years and never had any issues  recently had  arrange  have surgery  Budapest and naturally wanted  fly    booked  flights from BHD  BUD via LHR online  their site Once booked  informed the hospital and confirmed  ,"['customer service', 'lounge experience', 'staff attitude']","[0.9704660177230835, 0.458797812461853, 0.2442254275083542]",neutral,0.5726749300956726
Trip Verified   Check  well organised  lounge  Cancun Efficient boarding process Given water bottle before take off  welcome drink Now COVID rules are being relaxed this needs  change Menu good and food acceptable Staff were experienced and well organised ,"['lounge experience', 'customer service', 'staff attitude']","[0.998066246509552, 0.9896789789199829, 0.9381332397460938]",positive,0.8327297568321228
Trip Verified   Departure LGW north  Aspire lounge Bag from fine lounge basic  time departure Cabin crew welcoming but only given menu water and amenity pack Looks like some  White Company bedding options removed Lunch was fine and good pre meal drinks ser,"['lounge experience', 'customer service', 'staff attitude']","[0.9703470468521118, 0.9562734961509705, 0.9086523652076721]",positive,0.5038960576057434
Not Verified   Booked flight six months before travel then month before the flight  cancelled the flight giving the option  rebook for another day  bearing  mind that people have work and school that wasnt ideal  top  booked parking for over three weeks  r,"['booking problems', 'flight delays', 'customer service']","[0.999019205570221, 0.9932729005813599, 0.9365680813789368]",negative,0.8236083984375
Not Verified   The airline cancelled  initial return flight with   hours layover  London and  only option was  book the next flight that has   hours layover Thats before  board the flight  Toronto While  understand schedule changes and   best  stay positiv,"['booking problems', 'flight delays', 'customer service']","[0.9961451888084412, 0.9951639175415039, 0.9687231183052063]",negative,0.6195815801620483
Not Verified    was traveling with  wife  business class from Seattle  Bangalore via connecting flight  London and  reserved our seats together while booking the tickets But mysteriously they changed  later and when  got our boarding pass they assigned  an,"['booking problems', 'staff attitude', 'customer service']","[0.9951751232147217, 0.9621498584747314, 0.8544232845306396]",neutral,0.6963766813278198
Trip Verified    usually avoid  because  its appalling customer service and sneaky extra charges but this flight was  only option Note that  actually charges for seat preselection  biz class    pounds  this case Does any other airline  the world dare  that,"['booking problems', 'staff attitude', 'seat comfort']","[0.9541518092155457, 0.6707193851470947, 0.393891304731369]",negative,0.8855697512626648
Not Verified   Aktion airport has only recently opened its new facilities and checkin and departure certainly seemed very clean and efficient although admittedly its only having  cope with  low passenger load  present  was good  see that checkin carefully ,"['customer service', 'staff attitude', 'lounge experience']","[0.8940330743789673, 0.490184485912323, 0.37305474281311035]",positive,0.7297648191452026
Trip Verified    want  say  big thank you  Kahina Ladjouze After frustratingly missing  flight due   road closures she helped  secure and book the next day flight without additional charges   really grateful,"['booking problems', 'flight delays', 'customer service']","[0.9959539175033569, 0.9898765087127686, 0.9896231293678284]",positive,0.9386295080184937
Trip Verified  After sixteen months  being grounded  COVID  felt almost surreal   back   heading for what   was essential summer sun  Greece  was blissfully quiet with  queues  checkin  security and even the Galleries South lounge was less frenetic than us,"['lounge experience', 'customer service', 'staff attitude']","[0.7565448880195618, 0.6879928112030029, 0.34780457615852356]",neutral,0.5998857617378235
Trip Verified   cancelled flight  Dec  Refund was promised  voucher form  call center  are now  months down the line  calls  which each   min waiting time and  email reminders Conclusion  that they are just going  circles  avoid issuing any voucher Head  c,"['booking problems', 'flight delays', 'customer service']","[0.995215117931366, 0.9937036633491516, 0.9744617938995361]",negative,0.7595434188842773
Trip Verified  Fantastic flight down  Heathrow Crew doing their best  keep everyone happy  challenging times Nice  see they have introduced  free snack and water Its  start,"['customer service', 'staff attitude', 'flight delays']","[0.9805198311805725, 0.9633239507675171, 0.953285813331604]",positive,0.9807337522506714
Trip Verified   Boarding and disembarking were greatly organised passengers were boarded  the gate  seperate rows from the backside  the front business minimizing the possiblity for jamming Same  disembarking passengers were asked  remain seated then row p,"['staff attitude', 'customer service', 'seat comfort']","[0.963974118232727, 0.9052330255508423, 0.4776693284511566]",neutral,0.8828955888748169
Trip Verified  This was not  best experience with  thus far  there were  couple  disappointments  was happy with the fast baggage checkin This was  bus gate which  not  favourite thing but not  blemish  the airline The COVID protocols are not  robust  they,"['baggage issues', 'customer service', 'staff attitude']","[0.9705411195755005, 0.7578482627868652, 0.45958855748176575]",negative,0.9003914594650269
Trip Verified    flight apart from they cancelled the majority  the outbound and crammed everybody  one flight After having  return cancelled  times  opted for  voucher   could rebook  new route  had not been informed before requesting the Evoucher and  wo,"['booking problems', 'staff attitude', 'flight delays']","[0.9958722591400146, 0.9925498962402344, 0.987421452999115]",negative,0.6980039477348328
Trip Verified  Absolutely appalling experience British Airways unfortunately has lowered its standards and   dismay Ive been recently having  much better flying experience with budget airlines rather than  Customer service representatives are completely cl,"['staff attitude', 'customer service', 'flight delays']","[0.9742173552513123, 0.8887084722518921, 0.4296529293060303]",negative,0.9172401428222656
Trip Verified  Had booked the above mentioned flight But the travel restrictions changed  week before the travel dates The airline didnt notify  until  learned that  could not fly with the airlines only  the airport when  went for checkin  was  single tick,"['booking problems', 'flight delays', 'customer service']","[0.9972606897354126, 0.9665342569351196, 0.918520450592041]",negative,0.5669422745704651
Trip Verified    return flight from Antigua  London was cancelled  times When  call   several times their computer system didnt work and they couldnt issue new ticket  the result  had  pay airport price for baggage   couldnt pay online without ticket They ,"['booking problems', 'flight delays', 'baggage issues']","[0.9978469014167786, 0.9965301156044006, 0.9933391213417053]",negative,0.8305607438087463
Not Verified    cancellations for  month Applying vouchers only  find out they dont work after new cancellation Terrible stammers  not recommend  anyone  Covid restrictions,"['booking problems', 'staff attitude', 'flight delays']","[0.9775386452674866, 0.9357914924621582, 0.5152488350868225]",negative,0.9299572706222534
Trip Verified    had travelled  India for  eye surgery   flight back  London Heathrow  was assisted   member  the cabin crew Madeline Thomas She was  amazing person  she made sure  was feeling okay   had come back from  surgery and was traveling  myself Sh,"['customer service', 'staff attitude', 'lounge experience']","[0.9772890210151672, 0.966923177242279, 0.6140392422676086]",positive,0.8212910294532776
Not Verified    was travelling back from Mexico City   business trip Fully aware  the covid safety restrictions  the moment which the staff   admirable job with  but nevertheless  lot  say  the state   First  the moment Firstly   lounge  all  Mexico City T,"['lounge experience', 'staff attitude', 'customer service']","[0.8605193495750427, 0.7001950144767761, 0.385238915681839]",neutral,0.6221831440925598
Not Verified   Charge  fee  make  amendment   booked holiday well  advance Absolutely disgraceful Their site says  fees for amendments and when you ring  they say that you ticked the terms and conditions box and refer  page   terms and conditions and use  ,"['staff attitude', 'booking problems', 'customer service']","[0.9353310465812683, 0.8380104303359985, 0.22193452715873718]",negative,0.8688125014305115
Not Verified   Good service the whole way Nothing exceptional but  was only  short flight Plane was clean and refreshments were provided  only issue  that the flight was packed  understandable   was just before Chirstmas but surely   not wise  have strange,"['customer service', 'staff attitude', 'lounge experience']","[0.973051905632019, 0.5237550139427185, 0.47163501381874084]",neutral,0.4516441524028778
Not Verified    entered the plane with  bunch  white flowers and  flight attendant joked that  should have felt obliged  bring the flowers when she realized that  was going   Mothers funeral with the flowers she was apologetic she had  idea why  was bringi,"['staff attitude', 'customer service', 'lounge experience']","[0.9868172407150269, 0.8157771229743958, 0.11794780194759369]",negative,0.6382713913917542
Trip Verified    was supposed  fly with Aeroflot  the   December  Moscow But because Russia has closed its borders like the majority  other countries the flight was canceled and  couldnt get home Ive also tried  fly through Antalya but the same situation o,"['booking problems', 'flight delays', 'customer service']","[0.9966668486595154, 0.9955507516860962, 0.7831551432609558]",negative,0.6959581971168518
